"product_id","product_title"
"0006564224","Communion Cup Filler: RW525"
"0076144011","Ninjas, Piranhas, and Galileo"
"0123456479","SHINING IMAGE HUGE PINK LEATHER JEWELRY BOX / CASE / STORAGE / ORGANIZER WITH TRAVEL CASE AND LOCK"
"0140715185","Great Expectations Mug"
"0143506110","AFL - Where's My Football? a Lift-the-flap Book [Board book]"
"0259632589","Revlon Touch & Glow Moisturising Makeup Foundation(natural Mist)"
"0307463826","Crochet Lace Innovations: 20 Dazzling Designs in Broomstick, Hairpin, Tunisian, and Exploded Lace"
"0307586588","Little Crochet: Modern Designs for Babies and Toddlers"
"0307586758","BurdaStyle Sewing Vintage Modern: Mastering Iconic Looks from the 1920s to 1980s"
"0307586901","Martha Stewart's Handmade Holiday Crafts: 225 Inspired Projects for Year-Round Celebrations"
"0307587142","I Spy DIY Style: Find Fashion You Love and Do It Yourself"
"0310809452","Names of Jesus Cross Bookends"
"0310809592","God is Love Walnut Keyholder with Message Board"
"0326591532","3 Spools X 300m Griffin 40 TKT Cotton Eyebrow Thread Facial Hair Removal - India"
"0326592458","2 Spools X 300m Griffin 40 TKT Cotton Eyebrow Thread Facial Hair Removal - India"
"0345234898","Metro/Metropolitan Suction Turbo Driven Carpet/Rug Tool (10.5"" wide). Part Number: MVC-200C"
"0385344570","Huge & Huggable Mochimochi: 20 Supersized Patterns for Big Knitted Friends"
"0385344945","Potter Craft Books-Once Upon A Knit"
"0439024536","One Mitten"
"0439712599","Spooky Hour"
"0439874734","Please Play Safe"
"0449819906","The Knit Stitch Pattern Handbook: An Essential Collection of 300 Designer Stitches and Techniques"
"047018342X","The Beginner's Guide to Real Estate Investing, Second Edition"
"0470343834","Beading VISUAL Quick Tips"
"0470343842","Wire Jewelry VISUAL Quick Tips"
"0470536454","Wiley Publishers Crocheting For Dummies Revised"
"0470902884","The Great Workplace Poster"
"0471749915","Teach Yourself Visually: Sewing"
"0486248208","Dover Publications-Butterfly Stained Glass Coloring Bk"
"048625531X","Easy Mazes Activity Book"
"0486268292","Dover Origami Paper: 24 7 x 7 Sheets in 12 Colors"
"0486274802","Dover Publications-Fun With Easy Origami"
"0486284115","Dover Publications-Dinosaur Tattoos"
"0486402029","Pirates Tattoos"
"0486416461","Dover Publications-Henna Tattoos"
"0486417700","Metallic Foil Origami Paper-5-7/8""X5-7/8"" 18/Pkg"
"048643530X","Dover Publications-Glitter Fairies Stickers"
"0486441075","Dover Publications-Glitter Dragon Stickers"
"0486448789","Dover Publications-Create Your Own Robot Stickers"
"0486449971","Dover Publications-Glow-In-The-Dark Dinosaur Stickers"
"0486456536","Dover Publications-Glitter Tattoos Butterflies"
"0486461726","Dover Publications-Beginner's Book Of Modular Origami"
"0486462137","Dover Publications-Glow-In-The-Dark Dragon Stickers"
"0486473082","Knitting Counterpanes"
"0486475468","Dover Publications-Deco Tech Geometric Coloring Book"
"0486477177","Paper Planes Origami Kit-"
"048647819X","What to Doodle? At the Aquarium"
"0486481026","3-D Coloring Book--Mystic Mandalas (Dover 3-D Coloring Book)"
"0525471294","The Best Pet of All"
"0545138345","The Goodnight Train"
"0560467893","Welland Chicago Wall Floating Corner Shelf, 20-Inch, Black"
"057808435X","Gangland to Promised Land (John Pridmore) - Paperback"
"0587014555","Triple Self Portrait 20X30 Poster Custom Print,Non Returnable"
"0587091045","Map Of The Middle East 20X30 Poster Custom Print,Non Returnable"
"0587168978","""Daybreak"" Print (Unframed Paper Print 20x30)"
"0587228237","Gary Trucking Co. Moving Truck - 12x18 Art Poster"
"0587234792","""Coos Bay Lighthouse"" Print (Canvas 20x30)"
"0587236000","""Small Bird On A Branch of Kaidozakura."" Print (Canvas 20x30)"
"058724027X","""Theodore Roosevelt"" Print (Unframed Paper Print 20x30)"
"0587244879","Thurgood Marshall 1957 20 x 30 Poster [Kitchen] [Kitchen]"
"0587247983","Einstein; Three Rules of Work 2009 12 x 18 Poster [Kitchen] [Kitchen]"
"0594035406","Peter Rabbit Musical Water Globe Playing Music to ""Ode to Joy"""
"059443338X","Porcelain Trinket Box - Floral & Butterfly Design"
"0594497523","2014-2015 Mid Year Vinyl LACEY MDALLION Organizer Weekly Engagement Calendar/Planner (18-month Planner Covering March 2014 - August 2015)"
"0594497531","2014-2015 Mid Year Vinyl BLACKBIRD Organizer Weekly Engagement Calendar/Planner (18-month Planner Covering March 2014 - August 2015)"
"0594519624","Peace and Flowers Pink Microfiber Fleece Throw 50"" x 60"""
"0609803190","Mehndi: The Art of Henna Body Painting"
"0615229344","Londa's Refined Embellishments for Creative Clothing [DVD]"
"0615240356","Prepared Binder - Home Edition"
"0615364241","A Compendium of Curiosities by Tim Holtz Idea-ology, 76 Page Book, TH92826"
"0615406416","Inspiration Station Book"
"0615512135","IDRAW Cars Sketchbook and Reference Guide, Black"
"0615530370","French Inspirations for Artful Hands"
"0615545076","A Compendium of Curiosities Volume II by Tim Holtz Idea-ology, 8.75 x .75 x 8.5 Inches, 77 Pages, TH93018"
"0615617484","Noppadol Paothong Photography NPP617480 Save the Last Dance"
"0615638309","Cozy Quilt Designs CZQCQD04020 Panel Play Book"
"0615709591","IDRAW Comics Sketchbook and Reference Guide, Blue"
"063506636X","Emancipation Proclamation Poster (Lincoln Bicentennial)"
"0641615809","Metal Black Quill and Ink Italian Writing Set"
"0641712154","Wooden Moveable Bendable Articulated Posable Female Right Hand Artist's Model"
"064180556X","Guaranteed Leak-proof Travel Mug 16 Oz"
"0641854129","Black Leather Sketch Set with Color Pencils"
"0641935161","Medici Lions Kraft Recycled Italian Leather Journal (9""x7"")"
"0641997078","Vera Bradley Tote Blue Rhapsody"
"0646277898","The Liver Cleansing Diet: Love Your Liver and Live Longer"
"0670010936","Llama Llama Plush"
"0671493183","Doggies (Boynton on Board)"
"0689875223","Little Quack's New Friend"
"0692021892","IDRAW Shoes Sketchbook and Reference Guide, Black"
"0698118308","Little Cloud"
"0700012346","5 PCS of 9mm 18K White Gold Plated Shinny Oval magnetic Clasps set with Swarovski Crystal"
"0700012370","5 PCS of 10mm 18K Yellow Gold Plated Round Pave magnetic Clasps set with Swarovski Crystal"
"070001246X","8mm 18K White Gold Plated Round Pave Magnetic Clasps set with Swarovski Crystal"
"0700012494","10mm 18K White Gold Plated Round Pave Magnetic Clasps set with Swarovski Crystal"
"0700012532","14mm 18K White Gold Plated Round Pave Screw Clasps set with Swarovski Crystal"
"0700012656","12mm 18K White Gold Plated Shinny Oval Rose shape box Clasp"
"0700022031","Wholesale 10PCS of 8mm 18K White Gold Plated Round Pave Magnetic Clasps set with Swarovski Crystal"
"070002204X","9mm 18K Yellow Gold Plated Oval shape Shinny Clip Clasp"
"0700022074","10x18mm 18K Yellow Gold Plated Shoe shaped Deco Clip Clasp set with Swarovski Crystal beads"
"0700022228","7mm 18K White Gold Plated Round Shinny Clip Clasp"
